{
  "schema_version": 1,
  "kind": "page_proof",
  "phase": "response",
  "exchange_id": "0199a4c1-0016-7000-8000-000000000016",
  "payload": {
    "page_proof": {
      "algorithm": "ed25519",
      "key_id": "utrace-browser-2026-09-01",
      "payload_b64url": "eyJjbGllbnRfaWQiOiIwMTk5YTRjMS0wMDE2LTcwMDAtODAwMC0wMDAwMDAwMGMxMDEifQ",
      "signature_b64url": "Q0hkR1J6azFVMmR1V2xoT2VtUkhPWGxpZWpWMVdWaFNhMXBZU25CamJXeDBXbGhKZFZveWJIWmhSMVo2V1RKc2RWcDVOWFZaV0ZK"
    },
    "document_attachment_id": "0199a4c1-0016-7000-8000-0000000a7701",
    "registry_revision": 18
  }
}
